{"$schema":"https://json-schema.org/draft/2020-12/schema","$id":"https://quirk.systems/schemas/intention.schema.json","title":"Quirk Intention","type":"object","additionalProperties":false,"required":["intention_id","goal_ref","statement","governs","status","validity"],"properties":{"intention_id":{"type":"string","pattern":"^intention\\.[a-z0-9._-]+$"},"goal_ref":{"type":"string"},"statement":{"type":"string","minLength":1},"governs":{"type":"array","items":{"enum":["method","quality","risk","relationship","pace","attention","expression","evidence"]},"minItems":1,"uniqueItems":true},"status":{"enum":["candidate","active","paused","fulfilled","superseded","expired"]},"validity":{"type":"object","additionalProperties":false,"required":["valid_from"],"properties":{"valid_from":{"type":"string","format":"date-time"},"valid_until":{"type":["string","null"],"format":"date-time"},"purpose_partition":{"type":"string"}}},"authority_ceiling":{"enum":["observe","infer","propose","execute_reversible","enforce_invariant","execute_protected"]},"evidence_refs":{"type":"array","items":{"type":"string"},"uniqueItems":true},"metadata":{"type":"object"}}}