{"intention_id":"intention.deck-grammar.preserve-invariants","goal_ref":"goal.deck-grammar.candidate-pack","statement":"Use different Persona, Aesthetic, and Affordance cards to alter how the Goal is pursued while preserving the Goal's facts, owned-card ledger, and external authority ceiling.","governs":["method","quality","risk","expression","evidence"],"status":"active","validity":{"valid_from":"2026-08-12T00:00:00Z","valid_until":null,"purpose_partition":"deck_grammar_live_proof"},"authority_ceiling":"propose","evidence_refs":["github://Quirk-Systems/quirk-os/pull/15"],"metadata":{"current_instruction_wins":true}}